<?xml version="1.0" encoding="ISO-8859-1"?>
<!DOCTYPE section SYSTEM "./tX.dtd">
<section name="bugs"> &db; <bugs>
    <subsection>
      <title>Bug Tracking</title>
      <para> To improve bug tracking for terminatorX I've setup a <link
        ref="http://www.bugzilla.org">bugzilla</link> installation on this machine. You can access
        this bugzilla <dblink id="bug42">here</dblink>. </para>
      <para> So if you find a bug in terminatorX or have a feature request please use this
        system so the issue can be handled properly. </para>
      <para> Of course you can also 
        <link ref="http://www-stud.fht-esslingen.de/bugzilla/query.cgi?product=terminatorX">check</link> whether your bug has been
        filed already. </para>
    </subsection>
    <subsection>
      <title>Access</title>
      <para> If you haven't used this bugzilla before you will have to get an <link
        ref="http://www-stud.fht-esslingen.de/bugzilla/createaccount.cgi">account</link>
        if you want to be able to file new bugs. </para>
    </subsection>
  </bugs>
</section>
