<?xml version="1.0" encoding="ISO-8859-1"?>
<!DOCTYPE section SYSTEM "./tX.dtd">
<section name="turntable gallery"> &db; <turntable>
    <para>While scratching with the mouse usually <italic>sounds</italic> the way terminatorX users
      want it to (at least if the feedback I get is representative) it doesn't really
      <italic>feel</italic> like scratching. The only way to get that traditional haptic feedback is
      to turn your turntable into a mouse device.</para>
    <para>If you want to do this without harming your mouse nor turntable, the method suggested by
      the terminatorX logo should be feasible. Optical input devices are known to produce best
      results in such a scenario. For those interested here's a <dblink
      id="oldtable">document</dblink> on how I turned my old turntable into a terminatorX device.</para>
    <para>Luckily a lot of terminatorX users have built their own turntables and I'm really happy to
      present some of these creations below. Please, if <italic>your</italic> turntable is missing
        <link ref="mailto:alex@lisas.de">send</link> me some pictures of it so I can add them here.
      <bold>Thanks</bold> to all contributors!</para>
    <turntabletable>
      <tt title="Adam's turntable">
        <author>
          <person>
            <name>Adam King</name>
            <email>aking@lgh.com.au</email>
          </person>
        </author>
        <text>
          <para>Adam's turntable features very unique colors. Not a single feature of the
	  mouse is left unused with this device: All buttons are available and the 2nd axis
	  can be controlled with the red knob.</para>
	  <para>For more details checkout Adam's <link ref="http://members.optusnet.com.au/adamjking/ttable.htm">website</link></para>
        </text>
        <ttimages>
          <image filename="adam1.jpg">
            <nopara>Those colors just rock</nopara>
          </image>
          <image filename="adam2.jpg">
            <nopara>Utlizes the mouse buttons</nopara>
          </image>
          <image filename="adam3.jpg">
            <nopara>From above</nopara>
          </image>
          <image filename="adam4.jpg">
            <nopara>Inside the box</nopara>
          </image>
          <image filename="adam5.jpg">
            <nopara>Smooth mouse integration</nopara>
          </image>
        </ttimages>
      </tt>
      <tt title="Bob's turntable">
        <author>
          <person>
            <name>Bob Arctor</name>
            <email>curious@pb194.luban.sdi.tpnet.pl</email>
          </person>
        </author>
        <text>
          <para>Bob's very interesting turntable transfers it&apos;s rotational speed via a belt.</para><para>He describes
	  his terminatorX device this way: <italic>&quot;The method is especially good for mixing, not only scratching, 
	  because it is very stable (belt eliminates vinyl imperfections, transferring only rotational speed)&quot;</italic></para>
        </text>
        <ttimages>
          <image filename="bob1.jpg">
            <nopara>Belt-driven</nopara>
          </image>
          <image filename="bob2.jpg">
            <nopara>Vinyl look and feel</nopara>
          </image>
          <image filename="bob3.jpg">
            <nopara>Mouse connection</nopara>
          </image>
          <image filename="bob4.jpg">
            <nopara>Works with different turntables</nopara>
          </image>
          <image filename="bob5.jpg">
            <nopara>Complete setup</nopara>
          </image>
          <image filename="bob6.jpg">
            <nopara>The belt</nopara>
          </image>
        </ttimages>
      </tt>      
      <tt title="Fernando's turntable">
        <author>
          <person>
            <name>Fernando S. Fabreti</name>
            <email>ffabreti@yahoo.com.br</email>
          </person>
        </author>
        <text>
          <para>Fernando's turntable differs from the others in this section as he attached the
            mouse to the tone arm of the turntable. Take a look at the &quot;in detail&quot; picture
            to find out how Fernando's table works.</para>
          <para>
            <italic>Note</italic>: Fernando also contributed a scratch - see <dblink
              id="scratches">users' scratches-section</dblink>.</para>
        </text>
        <ttimages>
          <image filename="fernando1.jpg">
            <nopara>The whole thing</nopara>
          </image>
          <image filename="fernando2.jpg">
            <nopara>A little closer</nopara>
          </image>
          <image filename="fernando3.jpg">
            <nopara>Even closer</nopara>
          </image>
          <image filename="fernando4.jpg">
            <nopara>In detail</nopara>
          </image>
          <image filename="fernando5.jpg">
            <nopara>Fernado in action</nopara>
          </image>
        </ttimages>
      </tt>
      <tt title="Toqer's turntable">
        <author>
          <person>
            <name>Toqer</name>
            <email>toqer@pacbell.net</email>
          </person>
        </author>
        <text>
          <para>Toqer is using an optical device for his turntable. The image is somewhat low-res
            but you get the idea.</para>
        </text>
        <ttimages>
          <image filename="toqer1.jpg">
            <nopara>Toqer's optical turntable</nopara>
          </image>
        </ttimages>
      </tt>
      <tt title="Matt's turntable">
        <author>
          <person>
            <name>Matt Thomas</name>
            <email>loopdloop@jaggedsoft.com</email>
          </person>
        </author>
        <text>
          <para>Proudly presenting DJ Loopdloop's terminatorX turntable. A very interesting approach
            that hides the mouse completely inside the turntable.</para>
          <para>Have a look...</para>
        </text>
        <ttimages>
          <image filename="matt1.jpg">
            <nopara>Could be a &quot;usual&quot; turntable</nopara>
          </image>
          <image filename="matt2.jpg">
            <nopara>But it's not</nopara>
          </image>
          <image filename="matt3.jpg">
            <nopara>Tricky details</nopara>
          </image>
        </ttimages>
      </tt>
      <tt title="My turntable">
        <author>
          <person>
            <name>Me</name>
            <email>alex@lisas.de</email>
          </person>
        </author>
        <text>
          <para>These are the pictures of my very own terminatorX turntable. The turntable is
            described in more detail <dblink id="oldtable">here</dblink>.</para>
        </text>
        <ttimages>
          <image filename="tt_normal.jpg">
            <nopara>The turntable and its connector</nopara>
          </image>
          <image filename="tt_top1.jpg">
            <nopara>Again</nopara>
          </image>
          <image filename="tt_top_zoom.jpg">
            <nopara>The motor</nopara>
          </image>
          <image filename="tt_open_total.jpg">
            <nopara>Turntable's inside</nopara>
          </image>
          <image filename="tt_mouse_axis.jpg">
            <nopara>The axis to connect</nopara>
          </image>
          <image filename="tt_mouse_connect.jpg">
            <nopara>Axis attached to motor</nopara>
          </image>
          <image filename="tt_the_mouse.jpg">
            <nopara>Maximum compatibility ;)</nopara>
          </image>
        </ttimages>
      </tt>
    </turntabletable>
    <para>Your turntable is missing? Please, <link ref="mailto:alex@lisas.de">send</link> me some
      pictures of it so I can add them.</para>
  </turntable>
</section>
