<?xml version='1.0' encoding='iso-8859-1'?>
<!DOCTYPE section SYSTEM "./tX.dtd">
<section name='download'>
  <download>
    <index>
      <title>Available Downloads</title>
    </index>
    <current version='3.80' havebz2='yes' />
    <subsection>
      <title>Requirements</title>
      <para>terminatorX requires: 
      <itemizedlist>
        <listitem>
          <nopara>A Linux or FreeBSD system with the GNU C library
          installed.</nopara>
        </listitem>
        <listitem>
          <nopara>
          <link ref='http://www.xfree86.org'>XFree86</link> with DGA/DirectMouse
          support. DGA should be available in all XFree86 releases after 3.3,
          but 
          <bold>not every X-server provides DGA</bold>, so please check that
          your X-server has that feature. 
          <newline />
          <!--
<red>WARNING:
</red>
 XFree86 Version 4.0.0 has buggy
              DGA-Mouse support, please upgrade to Version 4.0.1 or above to
              be able to use terminatorX-->
</nopara>
        </listitem>
        <listitem>
          <nopara>The 
          <link ref='http://www.gtk.org'>Gimp Toolkit - gtk+</link> Version 2.0
          or above</nopara>
        </listitem>
        <listitem>
          <nopara>
          <link ref='http://www.ladspa.org'>LADSPA</link> The Linux Audio
          Developer's Simple Plugin API</nopara>
        </listitem>
        <listitem>
          <nopara>
          <link ref='http://www.libxml.org'>LibXML</link> which comes installed
          with most distributions</nopara>
        </listitem>
        <listitem>
          <nopara>terminatorX supports Steve Harris' 
          <link ref='http://plugin.org.uk/lrdf/'>liblrdf</link> which allows
          categorizing LADSPA plugins. Although terminatorX can be built
          without liblrdf support I strongly recommend installing it when you
          plan on using Steve Harris' wonderful 
          <link ref='http://plugin.org.uk/'>plugin collection</link> with
          terminatorX.</nopara>
        </listitem>
        <listitem>
          <nopara>terminatorX' MIDI interface is based on the ALSA sequencer
          API and therefor requires a working 
          <link ref='http://www.alsa-project.org'>ALSA</link> setup</nopara>
        </listitem>
        <listitem>
          <para>To enhance audiofile support I strongly recommend installing: 
          <itemizedlist>
            <listitem>
              <nopara>
              <link ref='http://www.68k.org/~michael/audiofile/'>
              libaudiofile</link> for loading wav, aiff and au files and 
              <link ref='http://sox.sourceforge.net'>sox</link> for
              pre-listening and loading of file formats not supported by
              libaudiofile.</nopara>
            </listitem>
            <listitem>
              <nopara>
              <link ref='http://www.xiph.org/ogg/vorbis/'>libvorbis</link> for
              loading of OGG Vorbis (.ogg) streams and 
              <link ref='http://www.xiph.org/ogg/vorbis/'>ogg123</link> for
              pre-listening to them.</nopara>
            </listitem>
            <listitem>
              <nopara>The 
              <link ref='http://www.mars.org/home/rob/proj/mpeg/'>
              mad</link> (MPEG Audio Decocder) library for loading mp3 streams
              and 
              <link ref='http://www.mpg123.de'>mpg123</link> or 
              <link ref='http://mpg321.sourceforge.net'>mpg321</link> for
              pre-listening of these.</nopara>
            </listitem>
          </itemizedlist>Note: Most of these libraries are included with
          current Linux distributions - so you might want to check your
          vendor's package list before building the libraries from
          source.</para>
        </listitem>
      </itemizedlist></para>
    </subsection>
    <subsection>
      <title>Current Version</title>
      <currentversion />
      <para>
      <link ref='http://www.debian.org'>Debian</link> users may prefer to
      install the 
      <link ref='http://packages.debian.org/unstable/sound/terminatorx.html'>
      terminatorX Debian package</link> via 
      <italic>apt-get</italic>.</para>
      <para>Mandrake users may be pleased to here that 
      <person>
        <name>Some</name>
        <email>email@email.de</email>
      </person> has created RPMs for their distribution 
      <link ref=''>here</link>.</para>
    </subsection>
    <subsection>
      <title>Old Sources</title>
      <tarfiles>
        <tar version='3.80' havebz2='yes' />
        <tar version='3.73' havebz2='yes' />
        <tar version='3.72' />
        <tar version='3.71' />
        <tar version='3.70' />
        <tar version='3.60' />
        <tar version='3.55' />
        <tar version='3.51' />
        <tar version='3.5' />
        <tar version='3.2' />
        <tar version='3.1' />
        <tar version='3.01' />
        <tar version='3.0' />
      </tarfiles>
    </subsection>
    <subsection>
      <title>Old RPMs</title>
      <rpmfiles>
        <!-- <rpm type="i386" version="3.80" rpmsubversion="1" distribution="Mandrake 9.1" note="no lilbrdf" ext="mdk"/> -->
<rpm rpmsubversion='1' version='3.80' type='i386' distribution='RH 8.0'
note='without liblrdf, ALSA, MIDI and libmad support' />
        <rpm rpmsubversion='1' version='3.73' type='i386' />
        <rpm rpmsubversion='1' version='3.72' type='i386' />
        <rpm rpmsubversion='2' version='3.71' type='i586' />
        <rpm rpmsubversion='1' version='3.70' type='i586' />
        <rpm rpmsubversion='2' version='3.60' type='i586' />
        <rpm rpmsubversion='2' version='3.71' type='sparc' />
        <rpm rpmsubversion='1' version='3.73' type='src' />
        <rpm rpmsubversion='1' version='3.72' type='src' />
        <rpm rpmsubversion='2' version='3.71' type='src' />
        <rpm rpmsubversion='1' version='3.70' type='src' />
        <rpm rpmsubversion='2' version='3.60' type='src' />
      </rpmfiles>
    </subsection>
    <subsection>
      <title>Historic Sources</title>
      <filelist>
        <file>terminatorX-V23.tar.gz</file>
        <file>terminatorX-V22.tar.gz</file>
      </filelist>
    </subsection>
    <subsection>
      <title>Samples</title>
      <para>I still have the "get you started"-samples 
      <file>scratch.wav</file> and 
      <file>beat.wav</file> available. If you have some audio files to scratch
      on but no beats (loops) lying around here is 
      <file>tX_beats.tar.bz2</file> which contains ten more beats I downloaded
      somewhere else - Sorry I don't remember where they're from - if you know
      please tell me so I can put some credits up here.</para>
      <para>If you want to have even more samples check out 
      <person>
        <name>Erik's</name>
        <email>e@osterman.com</email>
      </person>
      <bold>huge</bold> sample-archive 
      (<link ref='http://ftp.osterman.com/pub/music/samples'>http</link>/<link 
           ref='ftp://ftp.osterman.com/pub/music/samples'>ftp</link>).</para>
    </subsection>
  </download>
</section>
