<?xml version="1.0" encoding="ISO-8859-1"?>
<!DOCTYPE section SYSTEM "./tX.dtd">
<section name="links"> &db; <links>
    <index>
      <title>Links</title>
    </index>
    <subsection>
      <title>Linux Audio</title>
      <ilink>
        <banner filename="th_snd1.gif"/>
        <dblink id="linuxsound"/>
        <para>
          <person>
            <name>Dave Philips</name>
            <email>dlphilp@bright.net</email>
          </person> has not only written a <link ref="http://www.nostarch.com/lms.htm">book</link>
          on Linux audio software (that features terminatorX) - he is also maintaining the wonderful
            <dblink id="linuxsound"/>. IMHO it's the most complete collection of links to Linux
          audio projects and very well structured. </para>
      </ilink>
      <!--<ilink>
        <banner filename="rezound.png"/>
        <dblink id="rezound"/>
        <para>I don't really want to go into recommending other Linux software packages (as without
          maintenance such a list will always seem unfair), but I'll make an exception for the cool
            <dblink id="rezound"/> as I think it's the perfect tool to be used for terminatorX'
          soundfile editor option. It is specifically well-suited for creating and modifying loops. </para>
      </ilink>-->
      <ilink>
        <banner filename="freshmeat.gif"/>
        <dblink id="freshmeat"/>
        <para>I guess it's not necessary to introduce <dblink id="freshmeat"/>. If you want to be
          informed about new terminatorX releases you might want to subscribe to the terminatorX
            <link ref="http://freshmeat.net/projects/terminatorX">freshmeat project</link>.</para>
      </ilink>
      <ilink>
        <banner filename="lad.png"/>
        <dblink id="lad"/>
        <para>If you're working on a Linux audio project, you really should join the <dblink
            id="lad">Linux Audio Developers' mailing list</dblink>. If you just want to use Linux
          audio applications you might want to check out the <link
            ref="http://www.linuxdj.com/audio/lad/subscribelau.php3">Linux Audio Users' mailing
          list</link>. </para>
      </ilink>
    </subsection>
    <subsection>
      <title>Distributions</title>
      <para>Quite some OS distributions include terminatorX nowadays:</para>
      <ilink>
        <banner filename="debian.png"/>
        <dblink id="debian"/>
        <para>Simply the best and biggest. The machines I develop terminatorX on all run <dblink
          id="debian"/> (sid) and although <dblink id="debian"/> is not specifically targeted at
          multimedia users it features a whole lot of audio applications as it's just
          <bold>so</bold> big. You can find the terminatorX package <dblink
          id="testing">here</dblink> (testing) and <dblink id="unstable">here</dblink> (unstable). </para>
      </ilink>
      <ilink>
        <banner filename="dynebolic.png"/>
        <dblink id="dynebolic"/>
        <para>Based on <dblink id="debian"/>, <dblink id="dynebolic"/> is a multimedia Linux
          distribution that boots of a CD-ROM and doesn't require harddisk installation. So if you
          just want to test terminatorX without actually installing Linux (what you really should do
          :) <dblink id="dynebolic"/> might be an option. And it runs on XBOXen, too. </para>
      </ilink>
      <ilink>
        <banner filename="agnula.png"/>
        <dblink id="agnula"/>
        <para>
          <dblink id="agnula"/> is a project that aims to create a Linux distribution specifically
          targeted at musicians. They have released a beta release of their <dblink id="debian"/>
          based <link ref="http://www.demudi.org">DeMUDI</link> distribution. </para>
      </ilink>
      <ilink>
        <banner filename="ccrma.png"/>
        <dblink id="ccrma"/>
        <para>
          <dblink id="ccrma"/> provides up-to-date RPM packages of many audio applications for
          RedHat 7.2, 8.0 and 9 distributions. Their terminatorX package has much more features
          enabled than the one that I provide (as they provide RPMs for the dependencies that don't
          come with RedHat, too). </para>
      </ilink>
      <ilink>
        <banner filename="suse.png"/>
        <dblink id="suse"/>
        <para>Thanks to <person>
            <name>Matthias</name>
            <email>mana@suse.de</email>
          </person>, <dblink id="suse"/> provide a terminatorX <link
          ref="http://www.suse.de/us/private/products/suse_linux/i386/packages_personal/terminatorx.html">package</link>
          for quite some time now.</para>
      </ilink>
      <ilink>
        <banner filename="freebsd.png"/>
        <link ref="http://www.freebsd.org"/>
        <para>If you want to use terminatorX on your <dblink id="freebsd"/> box, you can use the
          official <link
            ref="http://www.FreeBSD.org/cgi/cvsweb.cgi/ports/audio/terminatorx">terminatorX port</link>.</para>
      </ilink>
    </subsection>
    <subsection>
      <title>terminatorX Coverage</title>
      <ilink>
        <banner filename="sonar.png"/>
        <dblink id="sonar"/>
        <para>The friendly people of <dblink id="sonar"/> invited me to do a terminatorX demo for
            <link ref="http://www.sonar.es/2003/eng/festival/rama.cfm">Sonarama</link> at the 2003
          Sonar festival (Friday 13th). </para>
      </ilink>
      <ilink>
        <banner filename="openjay.png"/>
        <dblink id="openjay"/>
        <para>
          <dblink id="openjay"/> is a website for open source DJs. <person>
            <name>J_Zar</name>
            <email>contact@openjay.org</email>
          </person> a very nice <link
          ref="http://www.openjay.org/modules.php?op=modload&amp;name=Sections&amp;file=index&amp;req=viewarticle&amp;artid=13&amp;page=1">review</link>
          on terminatorX. </para>
      </ilink>
      <ilink>
        <banner filename="neural.png"/>
        <dblink id="neural"/>
        <para>
          <dblink id="neural"/> is an online magazine for hacktivism, e-music and new media art.
          They have an Italian <link
          ref="http://www.neural.it/nnews/terminatorx.htm">introduction</link> on terminatorX.</para>
      </ilink>
      <ilink>
        <banner filename="or.png"/>
        <link ref="http://linux.oreillynet.com"/>
        <para>
          <person>
            <name>Dave</name>
            <email>dlphilp@bright.net</email>
          </person> wrote an introductory <link
          ref="http://linux.oreillynet.com/pub/a/linux/2001/02/02/ladspa.html">article</link> on
            <dblink id="ladspa"/> plugins and hosts that features terminatorX. </para>
      </ilink>
      <ilink>
        <banner filename="ct.png"/>
        <dblink id="ct"/>
        <para>The German computer magazine <dblink id="ct"/> once had terminatorX <link
          ref="http://www.heise.de/ct/shareware/default.shtml?prg=1845">included</link> on their
          freeware CDROM.</para>
      </ilink>
    </subsection>
    <!--
    <subsection>
      <title>Contributors (incomplete)</title>
      <ilink>
        <banner filename="kover.png"/>
        <dblink id="ladspa"/>
        <para/>
      </ilink>
    </subsection>
    -->
  </links>
</section>
